{
  "version": 1,
  "last_verified": "2026-10-16",
  "source": "Seeded 2026-10-16. Every entry below was checked against the official source named in its source_url on that date; the fact checked (number, hours, languages, cost) is quoted next to the source in the entry's verification_note. Entries that could NOT be confirmed from an official source today carry verification_status \"needs_verification\", say why, and are excluded from agent results until a human re-verifies them (AGENTS.md safety rule 6). This directory is support options, not a crisis service: at HIGH/IMMINENT risk the deterministic crisis flow always wins.",
  "disclaimer": "Manovia is a self-help companion, not a crisis service, and this directory is information, not a referral. Numbers and hours drift: each entry names its source and the date a person last checked it. In an emergency call your local emergency number first.",
  "regions": ["GLOBAL", "IN", "IN-WB", "US", "GB", "CA"],
  "resources": [
    {
      "id": "in-tele-manas",
      "regions": ["IN"],
      "kind": "national_helpline",
      "name": "Tele-MANAS (Government of India)",
      "description": "India's national tele-mental-health service, run by the Ministry of Health and Family Welfare. Trained counsellors answer calls, with referral to specialists. Launched 10 October 2022; cells in every state and union territory.",
      "contact": {"phone": ["14416", "1-800-891-4416"], "web": "https://telemanas.mohfw.gov.in/"},
      "languages": ["en", "hi", "bn"],
      "multilingual": true,
      "language_note": "English, Hindi and 20+ Indian regional languages, per the official site.",
      "cost": "free",
      "cost_note": "Toll-free.",
      "hours": "24/7",
      "needs": ["any"],
      "audience": "everyone in India",
      "source_url": "https://telemanas.mohfw.gov.in/",
      "last_verified": "2026-10-16",
      "verification_status": "verified",
      "verification_note": "Numbers 14416 and 1-800-891-4416 and 24x7 availability read from the official Tele-MANAS site (telemanas.mohfw.gov.in) on 2026-10-16; programme run by MoHFW per dghs.mohfw.gov.in National Mental Health Programme page."
    },
    {
      "id": "in-kiran",
      "regions": ["IN"],
      "kind": "national_helpline",
      "name": "KIRAN Mental Health Rehabilitation Helpline",
      "description": "Toll-free helpline of the Department of Empowerment of Persons with Disabilities, Ministry of Social Justice and Empowerment. Early screening, first aid, psychological support, distress management and referral.",
      "contact": {"phone": ["1800-599-0019"]},
      "languages": ["hi", "bn", "en", "as", "ta", "mr", "od", "te", "ml", "gu", "pa", "kn", "ur"],
      "cost": "free",
      "cost_note": "Toll-free.",
      "hours": "24/7",
      "needs": ["any"],
      "audience": "everyone in India",
      "source_url": "https://www.pib.gov.in/pressreleaseshare.aspx?prid=1652240&reg=48&lang=2",
      "last_verified": "2026-10-16",
      "verification_status": "verified",
      "verification_note": "Number 1800-599-0019, 24x7 operation and the 13 named languages (Hindi, Assamese, Tamil, Marathi, Odia, Telugu, Malayalam, Gujarati, Punjabi, Kannada, Bengali, Urdu, English) are from the ministry's PIB release (prid=1652240)."
    },
    {
      "id": "in-icall",
      "regions": ["IN"],
      "kind": "crisis_line",
      "name": "iCALL Psychosocial Helpline (TISS, Mumbai)",
      "description": "Free telephone, email and chat counselling run by the School of Human Ecology, Tata Institute of Social Sciences. Anyone in emotional or psychological distress, any age.",
      "contact": {"phone": ["9152987821"], "email": "icall@tiss.edu", "web": "https://icallhelpline.org/"},
      "languages": ["en", "hi"],
      "cost": "free",
      "hours": "Mon-Sat 08:00-21:00 IST",
      "needs": ["emotional_support", "crisis", "anxiety", "depression", "stress", "relationships"],
      "audience": "everyone in India",
      "source_url": "https://icallhelpline.org/",
      "last_verified": "2026-10-16",
      "verification_status": "verified",
      "verification_note": "Number 9152987821, email icall@tiss.ac.in and Mon-Sat 08:00-21:00 hours read from the service's own site icallhelpline.org on 2026-10-16."
    },
    {
      "id": "in-aasra",
      "regions": ["IN"],
      "kind": "crisis_line",
      "name": "AASRA (Mumbai, takes calls nationally)",
      "description": "Suicide-prevention and emotional-support helpline, a unit of Befrienders Worldwide/Samaritans, run since 1998.",
      "contact": {"phone": ["+91-22-27546669"], "email": "aasrahelpline@yahoo.com", "web": "https://www.aasra.info/"},
      "languages": ["en", "hi"],
      "cost": "free",
      "hours": "24/7",
      "needs": ["crisis", "emotional_support"],
      "audience": "everyone; Mumbai-based, takes calls nationally",
      "source_url": "https://www.aasra.info/",
      "last_verified": "2026-10-16",
      "verification_status": "verified",
      "verification_note": "24x7 number +91-22-27546669 read from the 'GET HELP' panel of aasra.info on 2026-10-16. The older widely-cited mobile +91-9820466726 appears on the site's contact page as a staff member's number, so the published 24x7 line is used here."
    },
    {
      "id": "in-vandrevala",
      "regions": ["IN"],
      "kind": "crisis_line",
      "name": "Vandrevala Foundation Helpline",
      "description": "Free 24x7 crisis-intervention helpline by phone and WhatsApp; counsellors handle calls in English, Hindi and major Indian regional languages.",
      "contact": {"phone": ["+91-99996-66555"], "web": "https://www.vandrevalafoundation.com/free-counseling"},
      "languages": ["en", "hi", "bn"],
      "multilingual": true,
      "language_note": "English, Hindi and major Indian regional languages, per the foundation.",
      "cost": "free",
      "hours": "24/7",
      "needs": ["crisis", "emotional_support", "anxiety", "depression"],
      "audience": "everyone in India; WhatsApp available",
      "source_url": "https://www.vandrevalafoundation.com/free-counseling",
      "last_verified": "2026-10-16",
      "verification_status": "verified",
      "verification_note": "Number +91 9999 666 555, 24x7x365 availability, call and WhatsApp, and languages read from vandrevalafoundation.com/free-counseling on 2026-10-16."
    },
    {
      "id": "in-fortis-stress",
      "regions": ["IN"],
      "kind": "national_helpline",
      "name": "Fortis Stress Helpline (Mental Health & Behavioural Sciences)",
      "description": "24x7 multilingual helpline run by Fortis Healthcare's Department of Mental Health and Behavioural Sciences for emotional distress, including exam stress.",
      "contact": {"phone": ["+91-83768-04102"], "email": "mentalhealth@fortishealthcare.com"},
      "languages": ["en", "hi", "bn"],
      "multilingual": true,
      "language_note": "14 languages including Assamese, Bengali, English, Gujarati, Hindi, Kannada, Konkani, Malayalam, Marathi, Punjabi, Tamil, Telugu, Urdu and Rajasthani, per the department.",
      "cost": "free",
      "hours": "24/7",
      "needs": ["stress", "exam_stress", "emotional_support", "crisis"],
      "audience": "everyone in India; students and parents",
      "source_url": "https://www.fortishealthcare.com/media-centre/press-release/fortis-hospital-anandapur-hosts-the-psych-ed-2019-zonal-finals",
      "last_verified": "2026-10-16",
      "verification_status": "verified",
      "verification_note": "Number +918376804102, 24x7 operation and the multilingual team are stated in Fortis Healthcare press releases (fortishealthcare.com) and in the Live Love Laugh helpline listing, both checked 2026-10-16."
    },
    {
      "id": "in-wb-lifeline-foundation",
      "regions": ["IN", "IN-WB"],
      "kind": "crisis_line",
      "name": "Lifeline Foundation (Kolkata)",
      "description": "Kolkata-based non-profit, the only organisation of its kind in West Bengal per its own site, offering free, anonymous, non-judgemental emotional support by phone since 1996.",
      "contact": {"phone": ["+91-91639-40404", "+91-90880-30303", "033-2463-7401", "033-2463-7432"], "web": "https://www.lifelinefoundation.in/"},
      "languages": ["en"],
      "cost": "free",
      "hours": "Mobile lines 24/7; 033 landlines 10:00-18:00 daily",
      "needs": ["crisis", "emotional_support", "depression"],
      "audience": "Kolkata and West Bengal; takes calls from across India",
      "source_url": "https://www.lifelinefoundation.in/",
      "last_verified": "2026-10-16",
      "verification_status": "verified",
      "verification_note": "Numbers +91 9163940404 and +91 9088030303 with '14x7 crisis helplines' read from lifelinefoundation.in on 2026-10-16; landline hours 10:00-18:00 daily from the AASRA state directory (aasra.info/helpline.html)."
    },
    {
      "id": "in-wb-jadavpur-ccsss",
      "regions": ["IN", "IN-WB"],
      "kind": "campus_counselling",
      "name": "Jadavpur University Centre for Counselling Services and Studies in Self-Development",
      "description": "Confidential counselling for Jadavpur University students, free of charge, on matters from addiction to career choice. Located on the 3rd floor of Darshan Bhavan, main campus.",
      "contact": {"phone": ["+91-33-2457-2481"], "email": "ccsssju@gmail.com", "web": "https://jadavpuruniversity.in/academics/centre-for-counselling-services-and-studies-in-self-development-ccsss/"},
      "languages": ["en"],
      "cost": "free",
      "hours": "Office hours (not published on the page)",
      "needs": ["emotional_support", "students", "stress", "relationships"],
      "audience": "Jadavpur University students",
      "source_url": "https://jadavpuruniversity.in/academics/centre-for-counselling-services-and-studies-in-self-development-ccsss/",
      "last_verified": "2026-10-16",
      "verification_status": "verified",